14:24:37.871936 IP localhost.41532 > localhost.italk: Flags [S], seq 4179578160, win 65495, options [mss 65495,sackOK,TS val 2986892161 ecr 0,nop,wscale 5], length 0
14:24:37.871963 IP localhost.italk > localhost.41532: Flags [S.], seq 1049400970, ack 4179578161, win 65483, options [mss 65495,sackOK,TS val 2986892161 ecr 2986892161,nop,wscale 5], length 0
14:24:37.871976 IP localhost.41532 > localhost.italk: Flags [.], ack 1, win 2047, options [nop,nop,TS val 2986892161 ecr 2986892161], length 0
14:24:37.872274 IP localhost.italk > localhost.41532: Flags [P.], seq 1:6, ack 1, win 2047, options [nop,nop,TS val 2986892161 ecr 2986892161], length 5
14:24:37.872288 IP localhost.italk > localhost.41532: Flags [F.], seq 6, ack 1, win 2047, options [nop,nop,TS val 2986892161 ecr 2986892161], length 0
14:24:37.872461 IP localhost.41532 > localhost.italk: Flags [.], ack 6, win 2047, options [nop,nop,TS val 2986892161 ecr 2986892161], length 0
14:24:37.872554 IP localhost.41532 > localhost.italk: Flags [F.], seq 1, ack 7, win 2047, options [nop,nop,TS val 2986892162 ecr 2986892161], length 0
14:24:37.872563 IP localhost.italk > localhost.41532: Flags [.], ack 2, win 2047, options [nop,nop,TS val 2986892162 ecr 2986892162], length 0
14:32:39.624746 IP localhost.41533 > localhost.italk: Flags [S], seq 1490914219, win 65495, options [mss 65495,sackOK,TS val 2987373914 ecr 0,nop,wscale 5], length 0
14:32:39.624779 IP localhost.italk > localhost.41533: Flags [S.], seq 2684314199, ack 1490914220, win 65483, options [mss 65495,sackOK,TS val 2987373914 ecr 2987373914,nop,wscale 5], length 0
14:32:39.624800 IP localhost.41533 > localhost.italk: Flags [.], ack 1, win 2047, options [nop,nop,TS val 2987373914 ecr 2987373914], length 0
14:32:39.624965 IP localhost.italk > localhost.41533: Flags [P.], seq 1:6, ack 1, win 2047, options [nop,nop,TS val 2987373914 ecr 2987373914], length 5
14:32:39.624986 IP localhost.italk > localhost.41533: Flags [F.], seq 6, ack 1, win 2047, options [nop,nop,TS val 2987373914 ecr 2987373914], length 0
14:32:39.625243 IP localhost.41533 > localhost.italk: Flags [.], ack 6, win 2047, options [nop,nop,TS val 2987373914 ecr 2987373914], length 0
14:32:39.625351 IP localhost.41533 > localhost.italk: Flags [F.], seq 1, ack 7, win 2047, options [nop,nop,TS val 2987373914 ecr 2987373914], length 0
14:32:39.625363 IP localhost.italk > localhost.41533: Flags [.], ack 2, win 2047, options [nop,nop,TS val 2987373914 ecr 2987373914], length 0
14:58:18.247019 IP localhost.41534 > localhost.italk: Flags [S], seq 1931628891, win 65495, options [mss 65495,sackOK,TS val 2988912536 ecr 0,nop,wscale 5], length 0
14:58:18.247058 IP localhost.italk > localhost.41534: Flags [S.], seq 1309527202, ack 1931628892, win 65483, options [mss 65495,sackOK,TS val 2988912536 ecr 2988912536,nop,wscale 5], length 0
14:58:18.247079 IP localhost.41534 > localhost.italk: Flags [.], ack 1, win 2047, options [nop,nop,TS val 2988912536 ecr 2988912536], length 0
14:58:18.247210 IP localhost.italk > localhost.41534: Flags [P.], seq 1:6, ack 1, win 2047, options [nop,nop,TS val 2988912536 ecr 2988912536], length 5
14:58:18.247226 IP localhost.italk > localhost.41534: Flags [F.], seq 6, ack 1, win 2047, options [nop,nop,TS val 2988912536 ecr 2988912536], length 0
14:58:18.247266 IP localhost.41534 > localhost.italk: Flags [.], ack 6, win 2047, options [nop,nop,TS val 2988912536 ecr 2988912536], length 0
14:58:18.247342 IP localhost.41534 > localhost.italk: Flags [F.], seq 1, ack 7, win 2047, options [nop,nop,TS val 2988912536 ecr 2988912536], length 0
14:58:18.247351 IP localhost.italk > localhost.41534: Flags [.], ack 2, win 2047, options [nop,nop,TS val 2988912536 ecr 2988912536], length 0
14:58:21.469655 IP localhost.41535 > localhost.italk: Flags [S], seq 1172614840, win 65495, options [mss 65495,sackOK,TS val 2988915759 ecr 0,nop,wscale 5], length 0
14:58:21.469678 IP localhost.italk > localhost.41535: Flags [S.], seq 823372607, ack 1172614841, win 65483, options [mss 65495,sackOK,TS val 2988915759 ecr 2988915759,nop,wscale 5], length 0
14:58:21.469692 IP localhost.41535 > localhost.italk: Flags [.], ack 1, win 2047, options [nop,nop,TS val 2988915759 ecr 2988915759], length 0
14:58:21.469875 IP localhost.italk > localhost.41535: Flags [P.], seq 1:6, ack 1, win 2047, options [nop,nop,TS val 2988915759 ecr 2988915759], length 5
14:58:21.469896 IP localhost.italk > localhost.41535: Flags [F.], seq 6, ack 1, win 2047, options [nop,nop,TS val 2988915759 ecr 2988915759], length 0
14:58:21.469951 IP localhost.41535 > localhost.italk: Flags [.], ack 6, win 2047, options [nop,nop,TS val 2988915759 ecr 2988915759], length 0
14:58:21.470041 IP localhost.41535 > localhost.italk: Flags [F.], seq 1, ack 7, win 2047, options [nop,nop,TS val 2988915759 ecr 2988915759], length 0
14:58:21.470052 IP localhost.italk > localhost.41535: Flags [.], ack 2, win 2047, options [nop,nop,TS val 2988915759 ecr 2988915759], length 0
14:59:51.936080 IP localhost.41536 > localhost.italk: Flags [S], seq 2051868101, win 65495, options [mss 65495,sackOK,TS val 2989006225 ecr 0,nop,wscale 5], length 0
14:59:51.936114 IP localhost.italk > localhost.41536: Flags [S.], seq 2364453794, ack 2051868102, win 65483, options [mss 65495,sackOK,TS val 2989006225 ecr 2989006225,nop,wscale 5], length 0
14:59:51.936133 IP localhost.41536 > localhost.italk: Flags [.], ack 1, win 2047, options [nop,nop,TS val 2989006225 ecr 2989006225], length 0
14:59:51.936252 IP localhost.italk > localhost.41536: Flags [P.], seq 1:6, ack 1, win 2047, options [nop,nop,TS val 2989006225 ecr 2989006225], length 5
14:59:51.936270 IP localhost.italk > localhost.41536: Flags [F.], seq 6, ack 1, win 2047, options [nop,nop,TS val 2989006225 ecr 2989006225], length 0
14:59:51.936329 IP localhost.41536 > localhost.italk: Flags [.], ack 6, win 2047, options [nop,nop,TS val 2989006225 ecr 2989006225], length 0
14:59:51.936439 IP localhost.41536 > localhost.italk: Flags [F.], seq 1, ack 7, win 2047, options [nop,nop,TS val 2989006225 ecr 2989006225], length 0
14:59:51.936454 IP localhost.italk > localhost.41536: Flags [.], ack 2, win 2047, options [nop,nop,TS val 2989006225 ecr 2989006225], length 0
15:19:01.449152 IP localhost.41537 > localhost.italk: Flags [S], seq 2218250308, win 65495, options [mss 65495,sackOK,TS val 2990155738 ecr 0,nop,wscale 5], length 0
15:19:01.449198 IP localhost.italk > localhost.41537: Flags [S.], seq 3620999357, ack 2218250309, win 65483, options [mss 65495,sackOK,TS val 2990155738 ecr 2990155738,nop,wscale 5], length 0
15:19:01.449220 IP localhost.41537 > localhost.italk: Flags [.], ack 1, win 2047, options [nop,nop,TS val 2990155738 ecr 2990155738], length 0
15:19:01.449540 IP localhost.italk > localhost.41537: Flags [P.], seq 1:13, ack 1, win 2047, options [nop,nop,TS val 2990155739 ecr 2990155738], length 12
15:19:01.449575 IP localhost.italk > localhost.41537: Flags [F.], seq 13, ack 1, win 2047, options [nop,nop,TS val 2990155739 ecr 2990155738], length 0
15:19:01.449642 IP localhost.41537 > localhost.italk: Flags [.], ack 13, win 2047, options [nop,nop,TS val 2990155739 ecr 2990155739], length 0
15:19:01.449889 IP localhost.41537 > localhost.italk: Flags [F.], seq 1, ack 14, win 2047, options [nop,nop,TS val 2990155739 ecr 2990155739], length 0
15:19:01.449906 IP localhost.italk > localhost.41537: Flags [.], ack 2, win 2047, options [nop,nop,TS val 2990155739 ecr 2990155739], length 0
15:20:08.932997 IP localhost.41538 > localhost.italk: Flags [S], seq 1513697821, win 65495, options [mss 65495,sackOK,TS val 2990223222 ecr 0,nop,wscale 5], length 0
15:20:08.933023 IP localhost.italk > localhost.41538: Flags [S.], seq 1123751399, ack 1513697822, win 65483, options [mss 65495,sackOK,TS val 2990223222 ecr 2990223222,nop,wscale 5], length 0
15:20:08.933038 IP localhost.41538 > localhost.italk: Flags [.], ack 1, win 2047, options [nop,nop,TS val 2990223222 ecr 2990223222], length 0
15:20:08.933192 IP localhost.italk > localhost.41538: Flags [P.], seq 1:13, ack 1, win 2047, options [nop,nop,TS val 2990223222 ecr 2990223222], length 12
15:20:08.933205 IP localhost.italk > localhost.41538: Flags [F.], seq 13, ack 1, win 2047, options [nop,nop,TS val 2990223222 ecr 2990223222], length 0
15:20:08.933279 IP localhost.41538 > localhost.italk: Flags [.], ack 13, win 2047, options [nop,nop,TS val 2990223222 ecr 2990223222], length 0
15:20:08.933361 IP localhost.41538 > localhost.italk: Flags [F.], seq 1, ack 14, win 2047, options [nop,nop,TS val 2990223222 ecr 2990223222], length 0
15:20:08.933376 IP localhost.italk > localhost.41538: Flags [.], ack 2, win 2047, options [nop,nop,TS val 2990223222 ecr 2990223222], length 0
15:30:59.156860 IP localhost.41539 > localhost.italk: Flags [S], seq 4116486164, win 65495, options [mss 65495,sackOK,TS val 2990873446 ecr 0,nop,wscale 5], length 0
15:30:59.156894 IP localhost.italk > localhost.41539: Flags [S.], seq 3992855953, ack 4116486165, win 65483, options [mss 65495,sackOK,TS val 2990873446 ecr 2990873446,nop,wscale 5], length 0
15:30:59.156914 IP localhost.41539 > localhost.italk: Flags [.], ack 1, win 2047, options [nop,nop,TS val 2990873446 ecr 2990873446], length 0
15:30:59.157069 IP localhost.italk > localhost.41539: Flags [P.], seq 1:13, ack 1, win 2047, options [nop,nop,TS val 2990873446 ecr 2990873446], length 12
15:30:59.157093 IP localhost.italk > localhost.41539: Flags [F.], seq 13, ack 1, win 2047, options [nop,nop,TS val 2990873446 ecr 2990873446], length 0
15:30:59.157151 IP localhost.41539 > localhost.italk: Flags [.], ack 13, win 2047, options [nop,nop,TS val 2990873446 ecr 2990873446], length 0
15:30:59.157266 IP localhost.41539 > localhost.italk: Flags [F.], seq 1, ack 14, win 2047, options [nop,nop,TS val 2990873446 ecr 2990873446], length 0
15:30:59.157282 IP localhost.italk > localhost.41539: Flags [.], ack 2, win 2047, options [nop,nop,TS val 2990873446 ecr 2990873446], length 0
15:44:54.090885 IP localhost.41540 > localhost.italk: Flags [S], seq 2677812277, win 65495, options [mss 65495,sackOK,TS val 2991708380 ecr 0,nop,wscale 5], length 0
15:44:54.090918 IP localhost.italk > localhost.41540: Flags [S.], seq 868434142, ack 2677812278, win 65483, options [mss 65495,sackOK,TS val 2991708380 ecr 2991708380,nop,wscale 5], length 0
15:44:54.090933 IP localhost.41540 > localhost.italk: Flags [.], ack 1, win 2047, options [nop,nop,TS val 2991708380 ecr 2991708380], length 0
15:44:54.091026 IP localhost.italk > localhost.41540: Flags [P.], seq 1:13, ack 1, win 2047, options [nop,nop,TS val 2991708380 ecr 2991708380], length 12
15:44:54.091037 IP localhost.italk > localhost.41540: Flags [F.], seq 13, ack 1, win 2047, options [nop,nop,TS val 2991708380 ecr 2991708380], length 0
15:44:54.091072 IP localhost.41540 > localhost.italk: Flags [.], ack 13, win 2047, options [nop,nop,TS val 2991708380 ecr 2991708380], length 0
15:44:54.091167 IP localhost.41540 > localhost.italk: Flags [F.], seq 1, ack 14, win 2047, options [nop,nop,TS val 2991708380 ecr 2991708380], length 0
15:44:54.091178 IP localhost.italk > localhost.41540: Flags [.], ack 2, win 2047, options [nop,nop,TS val 2991708380 ecr 2991708380], length 0

6332 IP ik1-312-16305.vs.sakura.ne.jp.41767 > dns13.sakura.ad.jp.domain: 19152+ PTR? 145.152.126.153.in-addr.arpa. (46)
14:29:02.391728 ARP, Request who-has ik1-312-16362.vs.sakura.ne.jp tell 153.126.152.2, length 46
14:29:02.400349 ARP, Request who-has ik1-312-16362.vs.sakura.ne.jp tell 153.126.152.2, length 46
14:29:02.401705 IP dns13.sakura.ad.jp.domain > ik1-312-16305.vs.sakura.ne.jp.41767: 19152 1/0/0 PTR ik1-312-16141.vs.sakura.ne.jp. (89)
14:29:02.402060 IP ik1-312-16305.vs.sakura.ne.jp.33909 > dns13.sakura.ad.jp.domain: 2505+ PTR? 116.153.126.153.in-addr.arpa. (46)
14:29:02.420503 IP dns13.sakura.ad.jp.domain > ik1-312-16305.vs.sakura.ne.jp.33909: 2505 1/0/0 PTR ik1-312-16362.vs.sakura.ne.jp. (89)
14:29:02.486910 ARP, Request who-has ik1-312-16054.vs.sakura.ne.jp tell 153.126.152.1, length 46
14:29:02.500335 ARP, Request who-has ik1-312-16363.vs.sakura.ne.jp tell 153.126.152.2, length 46
14:29:02.500369 ARP, Request who-has ik1-312-16373.vs.sakura.ne.jp tell 153.126.152.2, length 46
14:29:02.634485 IP6 fe80::1 > ff02::12: ip-proto-112 40
14:29:02.634749 IP 153.126.152.1 > vrrp.mcast.net: VRRPv2, Advertisement, vrid 13, prio 255, authtype simple, intvl 1s, length 20
14:29:02.702285 ARP, Request who-has ik1-312-16171.vs.sakura.ne.jp tell 153.126.152.2, length 46
14:29:02.702321 ARP, Request who-has ik1-312-16325.vs.sakura.ne.jp tell 153.126.152.2, length 46
14:29:02.717292 ARP, Request who-has sakuemon.net tell 153.126.152.2, length 46
14:29:02.717328 ARP, Request who-has ik1-312-16192.vs.sakura.ne.jp tell 153.126.152.2, length 46
14:29:02.717576 ARP, Request who-has ik1-312-16486.vs.sakura.ne.jp tell 153.126.152.2, length 46
14:29:02.800322 ARP, Request who-has ik1-312-16456.vs.sakura.ne.jp tell 153.126.152.2, length 46
14:29:02.830266 ARP, Request who-has ik1-312-16182.vs.sakura.ne.jp tell 153.126.152.2, length 46
14:29:02.830591 IP ik1-312-16305.vs.sakura.ne.jp.44346 > dns13.sakura.ad.jp.domain: 54073+ PTR? 186.152.126.153.in-addr.arpa. (46)
14:29:02.851072 IP dns13.sakura.ad.jp.domain > ik1-312-16305.vs.sakura.ne.jp.44346: 54073 1/0/0 PTR ik1-312-16182.vs.sakura.ne.jp. (89)
14:29:02.963956 ARP, Request who-has ik1-312-16381.vs.sakura.ne.jp tell 153.126.152.2, length 46
14:29:02.964236 IP ik1-312-16305.vs.sakura.ne.jp.46379 > dns13.sakura.ad.jp.domain: 56055+ PTR? 135.153.126.153.in-addr.arpa. (46)
14:29:02.966003 ARP, Request who-has ik1-312-16125.vs.sakura.ne.jp tell 153.126.152.1, length 46
14:29:02.982177 IP dns13.sakura.ad.jp.domain > ik1-312-16305.vs.sakura.ne.jp.46379: 56055 1/0/0 PTR ik1-312-16381.vs.sakura.ne.jp. (89)
14:29:02.982546 IP ik1-312-16305.vs.sakura.ne.jp.52945 > dns13.sakura.ad.jp.domain: 51229+ PTR? 129.152.126.153.in-addr.arpa. (46)
14:29:03.003815 IP dns13.sakura.ad.jp.domain > ik1-312-16305.vs.sakura.ne.jp.52945: 51229 1/0/0 PTR ik1-312-16125.vs.sakura.ne.jp. (89)
14:29:03.187261 ARP, Request who-has ik1-312-16141.vs.sakura.ne.jp tell 153.126.152.1, length 46
14:29:03.193960 ARP, Request who-has www.gyaon3.com tell 153.126.152.2, length 46
14:29:03.194215 IP ik1-312-16305.vs.sakura.ne.jp.45240 > dns13.sakura.ad.jp.domain: 7297+ PTR? 171.152.126.153.in-addr.arpa. (46)
14:29:03.200018 ARP, Request who-has ik1-312-16280.vs.sakura.ne.jp tell 153.126.152.2, length 46
14:29:03.207869 ARP, Request who-has ik1-312-16213.vs.sakura.ne.jp tell 153.126.152.1, length 46
14:29:03.207892 ARP, Request who-has ik1-312-16428.vs.sakura.ne.jp tell 153.126.152.1, length 46
14:29:03.214883 IP dns13.sakura.ad.jp.domain > ik1-312-16305.vs.sakura.ne.jp.45240: 7297 1/0/0 PTR www.gyaon3.com. (74)
14:29:03.215189 IP ik1-312-16305.vs.sakura.ne.jp.54437 > dns13.sakura.ad.jp.domain: 39044+ PTR? 217.152.126.153.in-addr.arpa. (46)
14:29:03.248092 IP dns13.sakura.ad.jp.domain > ik1-312-16305.vs.sakura.ne.jp.54437: 39044 1/0/0 PTR ik1-312-16213.vs.sakura.ne.jp. (89)
14:29:03.248449 IP ik1-312-16305.vs.sakura.ne.jp.34266 > dns13.sakura.ad.jp.domain: 18626+ PTR? 182.153.126.153.in-addr.arpa. (46)
14:29:03.266933 IP dns13.sakura.ad.jp.domain > ik1-312-16305.vs.sakura.ne.jp.34266: 18626 1/0/0 PTR ik1-312-16428.vs.sakura.ne.jp. (89)
14:29:03.292078 ARP, Request who-has ik1-312-16294.vs.sakura.ne.jp tell 153.126.152.2, length 46
14:29:03.292373 IP ik1-312-16305.vs.sakura.ne.jp.60454 > dns13.sakura.ad.jp.domain: 13987+ PTR? 48.153.126.153.in-addr.arpa. (45)
14:29:03.300074 ARP, Request who-has ik1-312-16147.vs.sakura.ne.jp tell 153.126.152.2, length 46
14:29:03.300649 ARP, Request who-has ik1-312-16381.vs.sakura.ne.jp tell 153.126.152.2, length 46
14:29:03.313038 IP dns13.sakura.ad.jp.domain > ik1-312-16305.vs.sakura.ne.jp.60454: 13987 1/0/0 PTR ik1-312-16294.vs.sakura.ne.jp. (88)
14:29:03.400289 ARP, Request who-has ik1-312-16362.vs.sakura.ne.jp tell 153.126.152.2, length 46
14:29:03.488202 ARP, Request who-has ik1-312-16054.vs.sakura.ne.jp tell 153.126.152.1, length 46
14:29:03.488991 ARP, Request who-has ik1-312-16428.vs.sakura.ne.jp tell 153.126.152.1, length 46
14:29:03.500321 ARP, Request who-has ik1-312-16373.vs.sakura.ne.jp tell 153.126.152.2, length 46
14:29:03.587950 ARP, Request who-has ik1-312-16125.vs.sakura.ne.jp tell 153.126.152.1, length 46
14:29:03.600044 ARP, Request who-has ik1-312-16294.vs.sakura.ne.jp tell 153.126.152.2, length 46
14:29:03.634486 IP6 fe80::1 > ff02::12: ip-proto-112 40
14:29:03.634517 IP 153.126.152.1 > vrrp.mcast.net: VRRPv2, Advertisement, vrid 13, prio 255, authtype simple, intvl 1s, length 20
14:29:03.700044 ARP, Request who-has ik1-312-16171.vs.sakura.ne.jp tell 153.126.152.2, length 46
14:29:03.715763 ARP, Request who-has ik1-312-16367.vs.sakura.ne.jp tell 153.126.152.2, length 46
14:29:03.716084 IP ik1-312-16305.vs.sakura.ne.jp.57926 > dns13.sakura.ad.jp.domain: 23380+ PTR? 121.153.126.153.in-addr.arpa. (46)
14:29:03.716340 ARP, Request who-has ik1-312-16487.vs.sakura.ne.jp tell 153.126.152.2, length 46
14:29:03.736594 IP dns13.sakura.ad.jp.domain > ik1-312-16305.vs.sakura.ne.jp.57926: 23380 1/0/0 PTR ik1-312-16367.vs.sakura.ne.jp. (89)
14:29:03.736988 IP ik1-312-16305.vs.sakura.ne.jp.51016 > dns13.sakura.ad.jp.domain: 20815+ PTR? 241.153.126.153.in-addr.arpa. (46)
14:29:03.757351 IP dns13.sakura.ad.jp.domain > ik1-312-16305.vs.sakura.ne.jp.51016: 20815 1/0/0 PTR ik1-312-16487.vs.sakura.ne.jp. (89)
14:29:03.800011 ARP, Request who-has ik1-312-16182.vs.sakura.ne.jp tell 153.126.152.2, length 46
14:29:03.800361 ARP, Request who-has ik1-312-16456.vs.sakura.ne.jp tell 153.126.152.2, length 46
14:29:04.174443 IP i114-182-149-109.s05.a020.ap.plala.or.jp.54187 > ik1-312-16305.vs.sakura.ne.jp.ssh: Flags [P.], seq 1:97, ack 240, win 62, length 96
14:29:04.176641 IP ik1-312-16305.vs.sakura.ne.jp.ssh > i114-182-149-109.s05.a020.ap.plala.or.jp.54187: Flags [P.], seq 240:336, ack 97, win 21468, length 96
14:29:04.187200 ARP, Request who-has ik1-312-16141.vs.sakura.ne.jp tell 153.126.152.1, length 46
14:29:04.204678 ARP, Request who-has ik1-312-16388.vs.sakura.ne.jp tell 153.126.152.1, length 46
14:29:04.205004 IP ik1-312-16305.vs.sakura.ne.jp.57074 > dns13.sakura.ad.jp.domain: 15423+ PTR? 142.153.126.153.in-addr.arpa. (46)
14:29:04.225485 IP dns13.sakura.ad.jp.domain > ik1-312-16305.vs.sakura.ne.jp.57074: 15423 1/0/0 PTR ik1-312-16388.vs.sakura.ne.jp. (89)
14:29:04.300223 ARP, Request who-has ik1-312-16381.vs.sakura.ne.jp tell 153.126.152.2, length 46
14:29:04.342582 ARP, Request who-has ik1-312-16354.vs.sakura.ne.jp tell 153.126.152.1, length 46
14:29:04.342918 IP ik1-312-16305.vs.sakura.ne.jp.36867 > dns13.sakura.ad.jp.domain: 18816+ PTR? 108.153.126.153.in-addr.arpa. (46)
14:29:04.352820 ARP, Request who-has ik1-312-16420.vs.sakura.ne.jp tell 153.126.152.2, length 46
14:29:04.353414 IP i114-182-149-109.s05.a020.ap.plala.or.jp.54187 > ik1-312-16305.vs.sakura.ne.jp.ssh: Flags [.], ack 336, win 62, length 0
14:29:04.363142 IP dns13.sakura.ad.jp.domain > ik1-312-16305.vs.sakura.ne.jp.36867: 18816 1/0/0 PTR ik1-312-16354.vs.sakura.ne.jp. (89)
14:29:04.363532 IP ik1-312-16305.vs.sakura.ne.jp.53866 > dns13.sakura.ad.jp.domain: 17966+ PTR? 174.153.126.153.in-addr.arpa. (46)
14:29:04.384042 IP dns13.sakura.ad.jp.domain > ik1-312-16305.vs.sakura.ne.jp.53866: 17966 1/0/0 PTR ik1-312-16420.vs.sakura.ne.jp. (89)
14:29:04.392391 ARP, Request who-has ik1-312-16144.vs.sakura.ne.jp tell 153.126.152.2, length 46
14:29:04.392712 IP ik1-312-16305.vs.sakura.ne.jp.40975 > dns13.sakura.ad.jp.domain: 53215+ PTR? 148.152.126.153.in-addr.arpa. (46)
14:29:04.433564 IP dns13.sakura.ad.jp.domain > ik1-312-16305.vs.sakura.ne.jp.40975: 53215 1/0/0 PTR ik1-312-16144.vs.sakura.ne.jp. (89)
14:29:04.487285 ARP, Request who-has ik1-312-16428.vs.sakura.ne.jp tell 153.126.152.1, length 46
14:29:04.580515 ARP, Request who-has ik1-312-16119.vs.sakura.ne.jp tell 153.126.152.1, length 46
14:29:04.580820 IP ik1-312-16305.vs.sakura.ne.jp.45283 > dns13.sakura.ad.jp.domain: 44763+ PTR? 123.152.126.153.in-addr.arpa. (46)
14:29:04.586605 ARP, Request who-has ik1-312-16125.vs.sakura.ne.jp tell 153.126.152.1, length 46
14:29:04.600333 ARP, Request who-has ik1-312-16294.vs.sakura.ne.jp tell 153.126.152.2, length 46
14:29:04.601253 IP dns13.sakura.ad.jp.domain > ik1-312-16305.vs.sakura.ne.jp.45283: 44763 1/0/0 PTR ik1-312-16119.vs.sakura.ne.jp. (89)
14:29:04.606476 ARP, Request who-has ik1-312-16033.vs.sakura.ne.jp tell 153.126.152.2, length 46
14:29:04.606815 IP ik1-312-16305.vs.sakura.ne.jp.43520 > dns13.sakura.ad.jp.domain: 35465+ PTR? 37.152.126.153.in-addr.arpa. (45)
14:29:04.627258 IP dns13.sakura.ad.jp.domain > ik1-312-16305.vs.sakura.ne.jp.43520: 35465 1/0/0 PTR ik1-312-16033.vs.sakura.ne.jp. (88)
14:29:04.634377 IP 153.126.152.1 > vrrp.mcast.net: VRRPv2, Advertisement, vrid 13, prio 255, authtype simple, intvl 1s, length 20
14:29:04.634403 IP6 fe80::1 > ff02::12: ip-proto-112 40
14:29:04.715425 ARP, Request who-has ik1-312-16014.vs.sakura.ne.jp tell 153.126.152.2, length 46
14:29:04.715579 ARP, Request who-has ik1-312-16194.vs.sakura.ne.jp tell 153.126.152.2, length 46
14:29:04.715756 IP ik1-312-16305.vs.sakura.ne.jp.48416 > dns13.sakura.ad.jp.domain: 7924+ PTR? 18.152.126.153.in-addr.arpa. (45)
14:29:04.734050 IP dns13.sakura.ad.jp.domain > ik1-312-16305.vs.sakura.ne.jp.48416: 7924 1/0/0 PTR ik1-312-16014.vs.sakura.ne.jp. (88)
14:29:04.734431 IP ik1-312-16305.vs.sakura.ne.jp.59818 > dns13.sakura.ad.jp.domain: 29499+ PTR? 198.152.126.153.in-addr.arpa. (46)
14:29:04.735834 ARP, Request who-has 153.126.153.3 tell 153.126.152.1, length 46
14:29:04.754998 IP dns13.sakura.ad.jp.domain > ik1-312-16305.vs.sakura.ne.jp.59818: 29499 1/0/0 PTR ik1-312-16194.vs.sakura.ne.jp. (89)
14:29:04.755393 IP ik1-312-16305.vs.sakura.ne.jp.38639 > dns13.sakura.ad.jp.domain: 13558+ PTR? 3.153.126.153.in-addr.arpa. (44)
14:29:04.775622 IP dns13.sakura.ad.jp.domain > ik1-312-16305.vs.sakura.ne.jp.38639: 13558 NXDomain 0/1/0 (100)
14:29:04.799930 ARP, Request who-has ik1-312-16182.vs.sakura.ne.jp tell 153.126.152.2, length 46
14:29:04.892125 ARP, Request who-has ik1-312-16224.vs.sakura.ne.jp tell 153.126.152.2, length 46
14:29:04.892421 IP ik1-312-16305.vs.sakura.ne.jp.33033 > dns13.sakura.ad.jp.domain: 14767+ PTR? 228.152.126.153.in-addr.arpa. (46)
14:29:04.899686 ARP, Request who-has ik1-312-16033.vs.sakura.ne.jp tell 153.126.152.2, length 46
14:29:04.912861 IP dns13.sakura.ad.jp.domain > ik1-312-16305.vs.sakura.ne.jp.33033: 14767 1/0/0 PTR ik1-312-16224.vs.sakura.ne.jp. (89)
14:29:04.950886 ARP, Request who-has ik1-312-16358.vs.sakura.ne.jp tell 153.126.152.1, length 46
14:29:04.951188 IP ik1-312-16305.vs.sakura.ne.jp.59623 > dns13.sakura.ad.jp.domain: 32278+ PTR? 112.153.126.153.in-addr.arpa. (46)
14:29:04.971821 IP dns13.sakura.ad.jp.domain > ik1-312-16305.vs.sakura.ne.jp.59623: 32278 1/0/0 PTR ik1-312-16358.vs.sakura.ne.jp. (89)
14:29:04.986859 ARP, Request who-has ik1-312-16119.vs.sakura.ne.jp tell 153.126.152.1, length 46
14:29:05.000049 ARP, Request who-has ik1-312-16144.vs.sakura.ne.jp tell 153.126.152.2, length 46
14:29:05.000084 ARP, Request who-has ik1-312-16224.vs.sakura.ne.jp tell 153.126.152.2, length 46
14:29:05.087008 ARP, Request who-has ik1-312-16354.vs.sakura.ne.jp tell 153.126.152.1, length 46
14:29:05.156504 ARP, Request who-has ik1-312-16369.vs.sakura.ne.jp tell 153.126.152.1, length 46
14:29:05.156779 IP ik1-312-16305.vs.sakura.ne.jp.38324 > dns13.sakura.ad.jp.domain: 39157+ PTR? 123.153.126.153.in-addr.arpa. (46)
14:29:05.174879 IP dns13.sakura.ad.jp.domain > ik1-312-16305.vs.sakura.ne.jp.38324: 39157 1/0/0 PTR ik1-312-16369.vs.sakura.ne.jp. (89)
14:29:05.200859 ARP, Request who-has ik1-312-16420.vs.sakura.ne.jp tell 153.126.152.2, length 46
14:29:05.207662 ARP, Request who-has ik1-312-16035.vs.sakura.ne.jp tell 153.126.152.1, length 46
14:29:05.207946 IP ik1-312-16305.vs.sakura.ne.jp.59461 > dns13.sakura.ad.jp.domain: 16146+ PTR? 39.152.126.153.in-addr.arpa. (45)
14:29:05.228300 IP dns13.sakura.ad.jp.domain > ik1-312-16305.vs.sakura.ne.jp.59461: 16146 1/0/0 PTR ik1-312-16035.vs.sakura.ne.jp. (88)
14:29:05.236403 ARP, Request who-has ik1-312-16175.vs.sakura.ne.jp tell 153.126.152.1, length 46
14:29:05.236675 IP ik1-312-16305.vs.sakura.ne.jp.42649 > dns13.sakura.ad.jp.domain: 44323+ PTR? 179.152.126.153.in-addr.arpa. (46)
14:29:05.257352 IP dns13.sakura.ad.jp.domain > ik1-312-16305.vs.sakura.ne.jp.42649: 44323 1/0/0 PTR ik1-312-16175.vs.sakura.ne.jp. (89)
14:29:05.400952 ARP, Request who-has ik1-312-16082.vs.sakura.ne.jp tell 153.126.152.1, length 46
14:29:05.401267 IP ik1-312-16305.vs.sakura.ne.jp.54455 > dns13.sakura.ad.jp.domain: 62317+ PTR? 86.152.126.153.in-addr.arpa. (45)
14:29:05.419469 IP dns13.sakura.ad.jp.domain > ik1-312-16305.vs.sakura.ne.jp.54455: 62317 1/0/0 PTR ik1-312-16082.vs.sakura.ne.jp. (88)
14:29:05.487092 ARP, Request who-has ik1-312-16358.vs.sakura.ne.jp tell 153.126.152.1, length 46
14:29:05.492465 ARP, Request who-has ik1-312-16342.vs.sakura.ne.jp tell 153.126.152.2, length 46
14:29:05.492820 IP ik1-312-16305.vs.sakura.ne.jp.33816 > dns13.sakura.ad.jp.domain: 15848+ PTR? 96.153.126.153.in-addr.arpa. (45)
14:29:05.510871 IP dns13.sakura.ad.jp.domain > ik1-312-16305.vs.sakura.ne.jp.33816: 15848 1/0/0 PTR ik1-312-16342.vs.sakura.ne.jp. (88)
14:29:05.586694 ARP, Request who-has ik1-312-16175.vs.sakura.ne.jp tell 153.126.152.1, length 46
14:29:05.586935 ARP, Request who-has 153.126.153.3 tell 153.126.152.1, length 46
14:29:05.587268 ARP, Request who-has ik1-312-16369.vs.sakura.ne.jp tell 153.126.152.1, length 46
14:29:05.592897 ARP, Request who-has 153.126.153.0 tell 153.126.152.2, length 46
14:29:05.593215 IP ik1-312-16305.vs.sakura.ne.jp.33955 > dns13.sakura.ad.jp.domain: 22836+ PTR? 0.153.126.153.in-addr.arpa. (44)
14:29:05.611311 IP dns13.sakura.ad.jp.domain > ik1-312-16305.vs.sakura.ne.jp.33955: 22836 NXDomain 0/1/0 (100)
14:29:05.634475 IP6 fe80::1 > ff02::12: ip-proto-112 40
14:29:05.634505 IP 153.126.152.1 > vrrp.mcast.net: VRRPv2, Advertisement, vrid 13, prio 255, authtype simple, intvl 1s, length 20
14:29:05.708728 ARP, Request who-has ik1-312-16059.vs.sakura.ne.jp tell 153.126.152.1, length 46
14:29:05.709040 IP ik1-312-16305.vs.sakura.ne.jp.51526 > dns13.sakura.ad.jp.domain: 52346+ PTR? 63.152.126.153.in-addr.arpa. (45)
14:29:05.716025 ARP, Request who-has ik1-312-16309.vs.sakura.ne.jp tell 153.126.152.2, length 46
14:29:05.728188 ARP, Request who-has ik1-312-16221.vs.sakura.ne.jp tell 153.126.152.2, length 46
14:29:05.729555 IP dns13.sakura.ad.jp.domain > ik1-312-16305.vs.sakura.ne.jp.51526: 52346 1/0/0 PTR ik1-312-16059.vs.sakura.ne.jp. (88)
14:29:05.729979 IP ik1-312-16305.vs.sakura.ne.jp.49378 > dns13.sakura.ad.jp.domain: 52653+ PTR? 63.153.126.153.in-addr.arpa. (45)
14:29:05.731062 ARP, Request who-has ik1-312-16235.vs.sakura.ne.jp tell 153.126.152.1, length 46
14:29:05.750812 IP dns13.sakura.ad.jp.domain > ik1-312-16305.vs.sakura.ne.jp.49378: 52653 1/0/0 PTR ik1-312-16309.vs.sakura.ne.jp. (88)
14:29:05.751192 IP ik1-312-16305.vs.sakura.ne.jp.34041 > dns13.sakura.ad.jp.domain: 35473+ PTR? 225.152.126.153.in-addr.arpa. (46)
14:29:05.771845 IP dns13.sakura.ad.jp.domain > ik1-312-16305.vs.sakura.ne.jp.34041: 35473 1/0/0 PTR ik1-312-16221.vs.sakura.ne.jp. (89)
14:29:05.772219 IP ik1-312-16305.vs.sakura.ne.jp.50184 > dns13.sakura.ad.jp.domain: 22512+ PTR? 239.152.126.153.in-addr.arpa. (46)
14:29:05.790304 IP dns13.sakura.ad.jp.domain > ik1-312-16305.vs.sakura.ne.jp.50184: 22512 1/0/0 PTR ik1-312-16235.vs.sakura.ne.jp. (89)
14:29:05.800104 ARP, Request who-has 153.126.153.0 tell 153.126.152.2, length 46
14:29:05.842741 ARP, Request who-has ik1-312-16100.vs.sakura.ne.jp tell 153.126.152.1, length 46
14:29:05.843073 IP ik1-312-16305.vs.sakura.ne.jp.43177 > dns13.sakura.ad.jp.domain: 26748+ PTR? 104.152.126.153.in-addr.arpa. (46)
14:29:05.863733 IP dns13.sakura.ad.jp.domain > ik1-312-16305.vs.sakura.ne.jp.43177: 26748 1/0/0 PTR ik1-312-16100.vs.sakura.ne.jp. (89)
14:29:05.899606 ARP, Request who-has ik1-312-16033.vs.sakura.ne.jp tell 153.126.152.2, length 46
14:29:05.951102 ARP, Request who-has ik1-312-16164.vs.sakura.ne.jp tell 153.126.152.1, length 46
14:29:05.951399 IP ik1-312-16305.vs.sakura.ne.jp.59367 > dns13.sakura.ad.jp.domain: 27956+ PTR? 168.152.126.153.in-addr.arpa. (46)
14:29:05.969594 IP dns13.sakura.ad.jp.domain > ik1-312-16305.vs.sakura.ne.jp.59367: 27956 1/0/0 PTR ik1-312-16164.vs.sakura.ne.jp. (89)
14:29:05.986741 ARP, Request who-has ik1-312-16059.vs.sakura.ne.jp tell 153.126.152.1, length 46
14:29:05.986807 ARP, Request who-has ik1-312-16119.vs.sakura.ne.jp tell 153.126.152.1, length 46
14:29:05.999922 ARP, Request who-has ik1-312-16144.vs.sakura.ne.jp tell 153.126.152.2, length 46
14:29:06.000396 ARP, Request who-has ik1-312-16224.vs.sakura.ne.jp tell 153.126.152.2, length 46
14:29:06.042924 ARP, Request who-has ik1-312-16342.vs.sakura.ne.jp tell 153.126.152.1, length 46
14:29:06.086773 ARP, Request who-has ik1-312-16100.vs.sakura.ne.jp tell 153.126.152.1, length 46
14:29:06.086957 ARP, Request who-has ik1-312-16354.vs.sakura.ne.jp tell 153.126.152.1, length 46
14:29:06.140228 ARP, Request who-has ik1-312-16308.vs.sakura.ne.jp tell 153.126.152.2, length 46
14:29:06.140505 IP ik1-312-16305.vs.sakura.ne.jp.44829 > dns13.sakura.ad.jp.domain: 24643+ PTR? 62.153.126.153.in-addr.arpa. (45)
14:29:06.161246 IP dns13.sakura.ad.jp.domain > ik1-312-16305.vs.sakura.ne.jp.44829: 24643 1/0/0 PTR ik1-312-16308.vs.sakura.ne.jp. (88)
14:29:06.201142 ARP, Request who-has ik1-312-16420.vs.sakura.ne.jp tell 153.126.152.2, length 46
14:29:06.207063 ARP, Request who-has lubuntu2.aka-tsuki.net tell 153.126.152.1, length 46
14:29:06.207319 IP ik1-312-16305.vs.sakura.ne.jp.35704 > dns13.sakura.ad.jp.domain: 62382+ PTR? 24.153.126.153.in-addr.arpa. (45)
14:29:06.227762 IP dns13.sakura.ad.jp.domain > ik1-312-16305.vs.sakura.ne.jp.35704: 62382 1/0/0 PTR lubuntu2.aka-tsuki.net. (81)
14:29:06.232122 ARP, Request who-has ik1-312-16472.vs.sakura.ne.jp tell 153.126.152.2, length 46
14:29:06.232366 IP ik1-312-16305.vs.sakura.ne.jp.47140 > dns13.sakura.ad.jp.domain: 25266+ PTR? 226.153.126.153.in-addr.arpa. (46)
14:29:06.250586 IP dns13.sakura.ad.jp.domain > ik1-312-16305.vs.sakura.ne.jp.47140: 25266 1/0/0 PTR ik1-312-16472.vs.sakura.ne.jp. (89)
14:29:06.265980 ARP, Request who-has ik1-312-16137.vs.sakura.ne.jp tell 153.126.152.1, length 46
14:29:06.266240 IP ik1-312-16305.vs.sakura.ne.jp.48525 > dns13.sakura.ad.jp.domain: 23034+ PTR? 141.152.126.153.in-addr.arpa. (46)
14:29:06.286696 ARP, Request who-has ik1-312-16082.vs.sakura.ne.jp tell 153.126.152.1, length 46
14:29:06.286963 IP dns13.sakura.ad.jp.domain > ik1-312-16305.vs.sakura.ne.jp.48525: 23034 1/0/0 PTR ik1-312-16137.vs.sakura.ne.jp. (89)
14:29:06.400056 ARP, Request who-has ik1-312-16342.vs.sakura.ne.jp tell 153.126.152.2, length 46
14:29:06.400303 ARP, Request who-has ik1-312-16472.vs.sakura.ne.jp tell 153.126.152.2, length 46
14:29:06.486858 ARP, Request who-has ik1-312-16164.vs.sakura.ne.jp tell 153.126.152.1, length 46
14:29:06.487055 ARP, Request who-has ik1-312-16358.vs.sakura.ne.jp tell 153.126.152.1, length 46
14:29:06.539854 ARP, Request who-has ik1-312-16324.vs.sakura.ne.jp tell 153.126.152.2, length 46
14:29:06.540153 IP ik1-312-16305.vs.sakura.ne.jp.45005 > dns13.sakura.ad.jp.domain: 59795+ PTR? 78.153.126.153.in-addr.arpa. (45)
14:29:06.558280 IP dns13.sakura.ad.jp.domain > ik1-312-16305.vs.sakura.ne.jp.45005: 59795 1/0/0 PTR ik1-312-16324.vs.sakura.ne.jp. (88)
14:29:06.586766 ARP, Request who-has ik1-312-16175.vs.sakura.ne.jp tell 153.126.152.1, length 46
14:29:06.586856 ARP, Request who-has ik1-312-16235.vs.sakura.ne.jp tell 153.126.152.1, length 46
14:29:06.586909 ARP, Request who-has 153.126.153.3 tell 153.126.152.1, length 46
14:29:06.587069 ARP, Request who-has ik1-312-16369.vs.sakura.ne.jp tell 153.126.152.1, length 46
14:29:06.603775 ARP, Request who-has ik1-312-16324.vs.sakura.ne.jp tell 153.126.152.2, length 46
14:29:06.634343 IP6 fe80::1 > ff02::12: ip-proto-112 40
14:29:06.634375 IP 153.126.152.1 > vrrp.mcast.net: VRRPv2, Advertisement, vrid 13, prio 255, authtype simple, intvl 1s, length 20
14:29:06.700070 ARP, Request who-has ik1-312-16221.vs.sakura.ne.jp tell 153.126.152.2, length 46
14:29:06.786940 ARP, Request who-has ik1-312-16137.vs.sakura.ne.jp tell 153.126.152.1, length 46
14:29:06.800016 ARP, Request who-has 153.126.153.0 tell 153.126.152.2, length 46
14:29:06.887155 ARP, Request who-has ik1-312-16342.vs.sakura.ne.jp tell 153.126.152.1, length 46
14:29:06.986615 ARP, Request who-has ik1-312-16059.vs.sakura.ne.jp tell 153.126.152.1, length 46
14:29:07.001540 ARP, Request who-has ik1-312-16308.vs.sakura.ne.jp tell 153.126.152.2, length 46
14:29:07.086718 ARP, Request who-has ik1-312-16100.vs.sakura.ne.jp tell 153.126.152.1, length 46
14:29:07.204975 ARP, Request who-has ik1-312-16217.vs.sakura.ne.jp tell 153.126.152.1, length 46
14:29:07.205281 IP ik1-312-16305.vs.sakura.ne.jp.45230 > dns13.sakura.ad.jp.domain: 101+ PTR? 221.152.126.153.in-addr.arpa. (46)
14:29:07.223499 IP dns13.sakura.ad.jp.domain > ik1-312-16305.vs.sakura.ne.jp.45230: 101 1/0/0 PTR ik1-312-16217.vs.sakura.ne.jp. (89)
14:29:07.286587 ARP, Request who-has ik1-312-16082.vs.sakura.ne.jp tell 153.126.152.1, length 46
14:29:07.400105 ARP, Request who-has ik1-312-16342.vs.sakura.ne.jp tell 153.126.152.2, length 46
14:29:07.400271 ARP, Request who-has ik1-312-16472.vs.sakura.ne.jp tell 153.126.152.2, length 46
14:29:07.464034 ARP, Request who-has ik1-312-16087.vs.sakura.ne.jp tell 153.126.152.2, length 46
14:29:07.464348 IP ik1-312-16305.vs.sakura.ne.jp.60442 > dns13.sakura.ad.jp.domain: 6026+ PTR? 91.152.126.153.in-addr.arpa. (45)
14:29:07.484624 IP dns13.sakura.ad.jp.domain > ik1-312-16305.vs.sakura.ne.jp.60442: 6026 1/0/0 PTR ik1-312-16087.vs.sakura.ne.jp. (88)
14:29:07.487049 ARP, Request who-has ik1-312-16164.vs.sakura.ne.jp tell 153.126.152.1, length 46
14:29:07.586847 ARP, Request who-has ik1-312-16235.vs.sakura.ne.jp tell 153.126.152.1, length 46
14:29:07.599910 ARP, Request who-has ik1-312-16324.vs.sakura.ne.jp tell 153.126.152.2, length 46
14:29:07.634296 IP 153.126.152.1 > vrrp.mcast.net: VRRPv2, Advertisement, vrid 13, prio 255, authtype simple, intvl 1s, length 20
14:29:07.634320 IP6 fe80::1 > ff02::12: ip-proto-112 40
14:29:07.699993 ARP, Request who-has ik1-312-16221.vs.sakura.ne.jp tell 153.126.152.2, length 46
14:29:07.707009 ARP, Request who-has ik1-312-16017.vs.sakura.ne.jp tell 153.126.152.2, length 46
14:29:07.707302 IP ik1-312-16305.vs.sakura.ne.jp.53590 > dns13.sakura.ad.jp.domain: 57494+ PTR? 21.152.126.153.in-addr.arpa. (45)
14:29:07.707339 ARP, Request who-has ik1-312-16431.vs.sakura.ne.jp tell 153.126.152.2, length 46
14:29:07.728018 IP dns13.sakura.ad.jp.domain > ik1-312-16305.vs.sakura.ne.jp.53590: 57494 1/0/0 PTR ik1-312-16017.vs.sakura.ne.jp. (88)
14:29:07.728374 IP ik1-312-16305.vs.sakura.ne.jp.35675 > dns13.sakura.ad.jp.domain: 39374+ PTR? 185.153.126.153.in-addr.arpa. (46)
14:29:07.739125 ARP, Request who-has ik1-312-16140.vs.sakura.ne.jp tell 153.126.152.2, length 46
14:29:07.749397 IP dns13.sakura.ad.jp.domain > ik1-312-16305.vs.sakura.ne.jp.35675: 39374 1/0/0 PTR ik1-312-16431.vs.sakura.ne.jp. (89)
14:29:07.749811 IP ik1-312-16305.vs.sakura.ne.jp.39294 > dns13.sakura.ad.jp.domain: 5323+ PTR? 144.152.126.153.in-addr.arpa. (46)
14:29:07.751164 ARP, Request who-has 153.126.153.4 tell 153.126.152.1, length 46
14:29:07.770137 IP dns13.sakura.ad.jp.domain > ik1-312-16305.vs.sakura.ne.jp.39294: 5323 1/0/0 PTR ik1-312-16140.vs.sakura.ne.jp. (89)
14:29:07.770513 IP ik1-312-16305.vs.sakura.ne.jp.53762 > dns13.sakura.ad.jp.domain: 14708+ PTR? 4.153.126.153.in-addr.arpa. (44)
14:29:07.786775 ARP, Request who-has ik1-312-16137.vs.sakura.ne.jp tell 153.126.152.1, length 46
14:29:07.788576 IP dns13.sakura.ad.jp.domain > ik1-312-16305.vs.sakura.ne.jp.53762: 14708 NXDomain 0/1/0 (100)
14:29:07.839393 ARP, Request who-has ik1-312-16162.vs.sakura.ne.jp tell 153.126.152.2, length 46
14:29:07.839721 IP ik1-312-16305.vs.sakura.ne.jp.54662 > dns13.sakura.ad.jp.domain: 45594+ PTR? 166.152.126.153.in-addr.arpa. (46)
14:29:07.860117 IP dns13.sakura.ad.jp.domain > ik1-312-16305.vs.sakura.ne.jp.54662: 45594 1/0/0 PTR ik1-312-16162.vs.sakura.ne.jp. (89)
14:29:07.887173 ARP, Request who-has ik1-312-16342.vs.sakura.ne.jp tell 153.126.152.1, length 46
14:29:08.000859 ARP, Request who-has ik1-312-16308.vs.sakura.ne.jp tell 153.126.152.2, length 46
14:29:08.004955 ARP, Request who-has ik1-312-16106.vs.sakura.ne.jp tell 153.126.152.1, length 46
14:29:08.005213 IP ik1-312-16305.vs.sakura.ne.jp.43831 > dns13.sakura.ad.jp.domain: 18664+ PTR? 110.152.126.153.in-addr.arpa. (46)
14:29:08.025468 IP dns13.sakura.ad.jp.domain > ik1-312-16305.vs.sakura.ne.jp.43831: 18664 1/0/0 PTR ik1-312-16106.vs.sakura.ne.jp. (89)
14:29:08.026313 ARP, Request who-has ik1-312-16227.vs.sakura.ne.jp tell 153.126.152.1, length 46
14:29:08.026595 IP ik1-312-16305.vs.sakura.ne.jp.51476 > dns13.sakura.ad.jp.domain: 22065+ PTR? 231.152.126.153.in-addr.arpa. (46)
14:29:08.047102 IP dns13.sakura.ad.jp.domain > ik1-312-16305.vs.sakura.ne.jp.51476: 22065 1/0/0 PTR ik1-312-16227.vs.sakura.ne.jp. (89)
14:29:08.164283 ARP, Request who-has ik1-312-16409.vs.sakura.ne.jp tell 153.126.152.2, length 46
14:29:08.164646 IP ik1-312-16305.vs.sakura.ne.jp.37652 > dns13.sakura.ad.jp.domain: 59457+ PTR? 163.153.126.153.in-addr.arpa. (46)
14:29:08.182804 IP dns13.sakura.ad.jp.domain > ik1-312-16305.vs.sakura.ne.jp.37652: 59457 1/0/0 PTR ik1-312-16409.vs.sakura.ne.jp. (89)
14:29:08.206399 ARP, Request who-has ik1-312-16098.vs.sakura.ne.jp tell 153.126.152.1, length 46
14:29:08.206433 ARP, Request who-has ik1-312-16332.vs.sakura.ne.jp tell 153.126.152.1, length 46
14:29:08.206438 ARP, Request who-has ik1-312-16392.vs.sakura.ne.jp tell 153.126.152.1, length 46
14:29:08.206726 IP ik1-312-16305.vs.sakura.ne.jp.33579 > dns13.sakura.ad.jp.domain: 41616+ PTR? 102.152.126.153.in-addr.arpa. (46)
14:29:08.227233 IP dns13.sakura.ad.jp.domain > ik1-312-16305.vs.sakura.ne.jp.33579: 41616 1/0/0 PTR ik1-312-16098.vs.sakura.ne.jp. (89)
14:29:08.227580 IP ik1-312-16305.vs.sakura.ne.jp.48902 > dns13.sakura.ad.jp.domain: 13747+ PTR? 86.153.126.153.in-addr.arpa. (45)
14:29:08.248307 IP dns13.sakura.ad.jp.domain > ik1-312-16305.vs.sakura.ne.jp.48902: 13747 1/0/0 PTR ik1-312-16332.vs.sakura.ne.jp. (88)
14:29:08.248674 IP ik1-312-16305.vs.sakura.ne.jp.53420 > dns13.sakura.ad.jp.domain: 59924+ PTR? 146.153.126.153.in-addr.arpa. (46)
14:29:08.269170 IP dns13.sakura.ad.jp.domain > ik1-312-16305.vs.sakura.ne.jp.53420: 59924 1/0/0 PTR ik1-312-16392.vs.sakura.ne.jp. (89)
14:29:08.299864 ARP, Request who-has ik1-312-16087.vs.sakura.ne.jp tell 153.126.152.2, length 46
14:29:08.442757 ARP, Request who-has ik1-312-16398.vs.sakura.ne.jp tell 153.126.152.1, length 46
14:29:08.443069 IP ik1-312-16305.vs.sakura.ne.jp.58278 > dns13.sakura.ad.jp.domain: 20967+ PTR? 152.153.126.153.in-addr.arpa. (46)
14:29:08.463896 IP dns13.sakura.ad.jp.domain > ik1-312-16305.vs.sakura.ne.jp.58278: 20967 1/0/0 PTR ik1-312-16398.vs.sakura.ne.jp. (89)
14:29:08.486944 ARP, Request who-has ik1-312-16398.vs.sakura.ne.jp tell 153.126.152.1, length 46
14:29:08.600019 ARP, Request who-has ik1-312-16140.vs.sakura.ne.jp tell 153.126.152.2, length 46
14:29:08.634249 IP 153.126.152.1 > vrrp.mcast.net: VRRPv2, Advertisement, vrid 13, prio 255, authtype simple, intvl 1s, length 20
14:29:08.634275 IP6 fe80::1 > ff02::12: ip-proto-112 40
14:29:08.665930 ARP, Request who-has ik1-312-16073.vs.sakura.ne.jp tell 153.126.152.1, length 46
14:29:08.666230 IP ik1-312-16305.vs.sakura.ne.jp.38767 > dns13.sakura.ad.jp.domain: 10347+ PTR? 77.152.126.153.in-addr.arpa. (45)
14:29:08.686723 ARP, Request who-has ik1-312-16106.vs.sakura.ne.jp tell 153.126.152.1, length 46
14:29:08.686783 IP dns13.sakura.ad.jp.domain > ik1-312-16305.vs.sakura.ne.jp.38767: 10347 1/0/0 PTR ik1-312-16073.vs.sakura.ne.jp. (88)
14:29:08.687028 ARP, Request who-has 153.126.153.4 tell 153.126.152.1, length 46
14:29:08.703743 ARP, Request who-has ik1-312-16372.vs.sakura.ne.jp tell 153.126.152.2, length 46
14:29:08.704060 IP ik1-312-16305.vs.sakura.ne.jp.40896 > dns13.sakura.ad.jp.domain: 55287+ PTR? 126.153.126.153.in-addr.arpa. (46)
14:29:08.724797 IP dns13.sakura.ad.jp.domain > ik1-312-16305.vs.sakura.ne.jp.40896: 55287 1/0/0 PTR ik1-312-16372.vs.sakura.ne.jp. (89)
14:29:08.786932 ARP, Request who-has ik1-312-16227.vs.sakura.ne.jp tell 153.126.152.1, length 46
14:29:08.799733 ARP, Request who-has ik1-312-16162.vs.sakura.ne.jp tell 153.126.152.2, length 46
14:29:09.099939 ARP, Request who-has ik1-312-16409.vs.sakura.ne.jp tell 153.126.152.2, length 46
14:29:09.218496 ARP, Request who-has ik1-312-16393.vs.sakura.ne.jp tell 153.126.152.1, length 46
14:29:09.218539 ARP, Request who-has ik1-312-16453.vs.sakura.ne.jp tell 153.126.152.1, length 46
14:29:09.218816 IP ik1-312-16305.vs.sakura.ne.jp.49645 > dns13.sakura.ad.jp.domain: 28764+ PTR? 147.153.126.153.in-addr.arpa. (46)
14:29:09.239195 IP dns13.sakura.ad.jp.domain > ik1-312-16305.vs.sakura.ne.jp.49645: 28764 1/0/0 PTR ik1-312-16393.vs.sakura.ne.jp. (89)
14:29:09.239541 IP ik1-312-16305.vs.sakura.ne.jp.57084 > dns13.sakura.ad.jp.domain: 31039+ PTR? 207.153.126.153.in-addr.arpa. (46)
14:29:09.257525 IP dns13.sakura.ad.jp.domain > ik1-312-16305.vs.sakura.ne.jp.57084: 31039 1/0/0 PTR ik1-312-16453.vs.sakura.ne.jp. (89)
14:29:09.264300 ARP, Request who-has ik1-312-16019.vs.sakura.ne.jp tell 153.126.152.2, length 46
14:29:09.264625 IP ik1-312-16305.vs.sakura.ne.jp.35150 > dns13.sakura.ad.jp.domain: 19577+ PTR? 23.152.126.153.in-addr.arpa. (45)
14:29:09.282741 IP dns13.sakura.ad.jp.domain > ik1-312-16305.vs.sakura.ne.jp.35150: 19577 1/0/0 PTR ik1-312-16019.vs.sakura.ne.jp. (88)
14:29:09.299770 ARP, Request who-has ik1-312-16087.vs.sakura.ne.jp tell 153.126.152.2, length 46
14:29:09.386427 ARP, Request who-has ik1-312-16073.vs.sakura.ne.jp tell 153.126.152.1, length 46
14:29:09.403992 ARP, Request who-has ik1-312-16436.vs.sakura.ne.jp tell 153.126.152.1, length 46
14:29:09.404276 IP ik1-312-16305.vs.sakura.ne.jp.35544 > dns13.sakura.ad.jp.domain: 14806+ PTR? 190.153.126.153.in-addr.arpa. (46)
14:29:09.405687 ARP, Request who-has ik1-312-16205.vs.sakura.ne.jp tell 153.126.152.2, length 46
14:29:09.424939 IP dns13.sakura.ad.jp.domain > ik1-312-16305.vs.sakura.ne.jp.35544: 14806 1/0/0 PTR ik1-312-16436.vs.sakura.ne.jp. (89)
14:29:09.425267 IP ik1-312-16305.vs.sakura.ne.jp.48456 > dns13.sakura.ad.jp.domain: 41596+ PTR? 209.152.126.153.in-addr.arpa. (46)
14:29:09.443427 IP dns13.sakura.ad.jp.domain > ik1-312-16305.vs.sakura.ne.jp.48456: 41596 1/0/0 PTR ik1-312-16205.vs.sakura.ne.jp. (89)
14:29:09.486945 ARP, Request who-has ik1-312-16398.vs.sakura.ne.jp tell 153.126.152.1, length 46
14:29:09.499655 ARP, Request who-has ik1-312-16019.vs.sakura.ne.jp tell 153.126.152.2, length 46
14:29:09.600356 ARP, Request who-has ik1-312-16140.vs.sakura.ne.jp tell 153.126.152.2, length 46
14:29:09.629266 ARP, Request who-has ik1-312-16094.vs.sakura.ne.jp tell 153.126.152.2, length 46
14:29:09.629580 IP ik1-312-16305.vs.sakura.ne.jp.39725 > dns13.sakura.ad.jp.domain: 47223+ PTR? 98.152.126.153.in-addr.arpa. (45)
14:29:09.634166 IP6 fe80::1 > ff02::12: ip-proto-112 40
14:29:09.634183 IP 153.126.152.1 > vrrp.mcast.net: VRRPv2, Advertisement, vrid 13, prio 255, authtype simple, intvl 1s, length 20
14:29:09.649888 IP dns13.sakura.ad.jp.domain > ik1-312-16305.vs.sakura.ne.jp.39725: 47223 1/0/0 PTR ik1-312-16094.vs.sakura.ne.jp. (88)
14:29:09.686761 ARP, Request who-has ik1-312-16106.vs.sakura.ne.jp tell 153.126.152.1, length 46
14:29:09.686844 ARP, Request who-has 153.126.153.4 tell 153.126.152.1, length 46
14:29:09.704204 ARP, Request who-has bellhandclub.co.jp tell 153.126.152.2, length 46
14:29:09.704525 IP ik1-312-16305.vs.sakura.ne.jp.41631 > dns13.sakura.ad.jp.domain: 6705+ PTR? 187.153.126.153.in-addr.arpa. (46)
14:29:09.722710 IP dns13.sakura.ad.jp.domain > ik1-312-16305.vs.sakura.ne.jp.41631: 6705 1/0/0 PTR bellhandclub.co.jp. (78)
14:29:09.787917 ARP, Request who-has ik1-312-16227.vs.sakura.ne.jp tell 153.126.152.1, length 46
14:29:09.799705 ARP, Request who-has ik1-312-16162.vs.sakura.ne.jp tell 153.126.152.2, length 46
14:29:09.801701 ARP, Request who-has ik1-312-16259.vs.sakura.ne.jp tell 153.126.152.2, length 46
14:29:09.801934 IP ik1-312-16305.vs.sakura.ne.jp.49980 > dns13.sakura.ad.jp.domain: 3040+ PTR? 13.153.126.153.in-addr.arpa. (45)
14:29:09.820169 IP dns13.sakura.ad.jp.domain > ik1-312-16305.vs.sakura.ne.jp.49980: 3040 1/0/0 PTR ik1-312-16259.vs.sakura.ne.jp. (88)
14:29:09.999759 ARP, Request who-has ik1-312-16094.vs.sakura.ne.jp tell 153.126.152.2, length 46
14:29:10.099678 ARP, Request who-has ik1-312-16205.vs.sakura.ne.jp tell 153.126.152.2, length 46
14:29:10.099707 ARP, Request who-has ik1-312-16259.vs.sakura.ne.jp tell 153.126.152.2, length 46
14:29:10.099948 ARP, Request who-has ik1-312-16409.vs.sakura.ne.jp tell 153.126.152.2, length 46
14:29:10.287071 ARP, Request who-has ik1-312-16436.vs.sakura.ne.jp tell 153.126.152.1, length 46
14:29:10.386476 ARP, Request who-has ik1-312-16073.vs.sakura.ne.jp tell 153.126.152.1, length 46
14:29:10.503599 ARP, Request who-has ik1-312-16019.vs.sakura.ne.jp tell 153.126.152.2, length 46
14:29:10.525986 ARP, Request who-has ik1-312-16127.vs.sakura.ne.jp tell 153.126.152.1, length 46
14:29:10.526282 IP ik1-312-16305.vs.sakura.ne.jp.57224 > dns13.sakura.ad.jp.domain: 19100+ PTR? 131.152.126.153.in-addr.arpa. (46)
14:29:10.544575 IP dns13.sakura.ad.jp.domain > ik1-312-16305.vs.sakura.ne.jp.57224: 19100 1/0/0 PTR ik1-312-16127.vs.sakura.ne.jp. (89)
14:29:10.601080 ARP, Request who-has ik1-312-16494.vs.sakura.ne.jp tell 153.126.152.2, length 46
14:29:10.601201 ARP, Request who-has ik1-312-16130.vs.sakura.ne.jp tell 153.126.152.1, length 46
14:29:10.601429 IP ik1-312-16305.vs.sakura.ne.jp.55780 > dns13.sakura.ad.jp.domain: 989+ PTR? 248.153.126.153.in-addr.arpa. (46)
14:29:10.621876 IP dns13.sakura.ad.jp.domain > ik1-312-16305.vs.sakura.ne.jp.55780: 989 1/0/0 PTR ik1-312-16494.vs.sakura.ne.jp. (89)
14:29:10.622187 IP ik1-312-16305.vs.sakura.ne.jp.47935 > dns13.sakura.ad.jp.domain: 61872+ PTR? 134.152.126.153.in-addr.arpa. (46)
14:29:10.634121 IP6 fe80::1 > ff02::12: ip-proto-112 40
14:29:10.634149 IP 153.126.152.1 > vrrp.mcast.net: VRRPv2, Advertisement, vrid 13, prio 255, authtype simple, intvl 1s, length 20
14:29:10.640573 IP dns13.sakura.ad.jp.domain > ik1-312-16305.vs.sakura.ne.jp.47935: 61872 1/0/0 PTR ik1-312-16130.vs.sakura.ne.jp. (89)
14:29:10.715144 ARP, Request who-has ik1-312-16494.vs.sakura.ne.jp tell 153.126.152.2, length 46
14:29:10.786741 ARP, Request who-has ik1-312-16127.vs.sakura.ne.jp tell 153.126.152.1, length 46
14:29:10.993126 ARP, Request who-has ik1-312-16262.vs.sakura.ne.jp tell 153.126.152.2, length 46
14:29:10.993427 IP ik1-312-16305.vs.sakura.ne.jp.34529 > dns13.sakura.ad.jp.domain: 45948+ PTR? 16.153.126.153.in-addr.arpa. (45)
14:29:10.999591 ARP, Request who-has ik1-312-16094.vs.sakura.ne.jp tell 153.126.152.2, length 46
14:29:11.013995 IP dns13.sakura.ad.jp.domain > ik1-312-16305.vs.sakura.ne.jp.34529: 45948 1/0/0 PTR ik1-312-16262.vs.sakura.ne.jp. (88)
14:29:11.038963 ARP, Request who-has ik1-312-16394.vs.sakura.ne.jp tell 153.126.152.1, length 46
14:29:11.039252 IP ik1-312-16305.vs.sakura.ne.jp.39754 > dns13.sakura.ad.jp.domain: 54635+ PTR? 148.153.126.153.in-addr.arpa. (46)
14:29:11.059909 IP dns13.sakura.ad.jp.domain > ik1-312-16305.vs.sakura.ne.jp.39754: 54635 1/0/0 PTR ik1-312-16394.vs.sakura.ne.jp. (89)
14:29:11.086437 ARP, Request who-has ik1-312-16130.vs.sakura.ne.jp tell 153.126.152.1, length 46
14:29:11.086747 ARP, Request who-has ik1-312-16394.vs.sakura.ne.jp tell 153.126.152.1, length 46
14:29:11.099595 ARP, Request who-has ik1-312-16205.vs.sakura.ne.jp tell 153.126.152.2, length 46
14:29:11.099657 ARP, Request who-has ik1-312-16259.vs.sakura.ne.jp tell 153.126.152.2, length 46
14:29:11.165933 ARP, Request who-has ik1-312-16173.vs.sakura.ne.jp tell 153.126.152.1, length 46
14:29:11.166219 IP ik1-312-16305.vs.sakura.ne.jp.39251 > dns13.sakura.ad.jp.domain: 2586+ PTR? 177.152.126.153.in-addr.arpa. (46)
14:29:11.186815 IP dns13.sakura.ad.jp.domain > ik1-312-16305.vs.sakura.ne.jp.39251: 2586 1/0/0 PTR ik1-312-16173.vs.sakura.ne.jp. (89)
14:29:11.189967 ARP, Request who-has ik1-312-16101.vs.sakura.ne.jp tell 153.126.152.1, length 46
14:29:11.190184 IP ik1-312-16305.vs.sakura.ne.jp.32916 > dns13.sakura.ad.jp.domain: 54181+ PTR? 105.152.126.153.in-addr.arpa. (46)
14:29:11.210788 IP dns13.sakura.ad.jp.domain > ik1-312-16305.vs.sakura.ne.jp.32916: 54181 1/0/0 PTR ik1-312-16101.vs.sakura.ne.jp. (89)
14:29:11.239182 ARP, Request who-has ik1-312-16018.vs.sakura.ne.jp tell 153.126.152.2, length 46
14:29:11.239606 IP ik1-312-16305.vs.sakura.ne.jp.60219 > dns13.sakura.ad.jp.domain: 42752+ PTR? 22.152.126.153.in-addr.arpa. (45)
14:29:11.259830 IP dns13.sakura.ad.jp.domain > ik1-312-16305.vs.sakura.ne.jp.60219: 42752 1/0/0 PTR ik1-312-16018.vs.sakura.ne.jp. (88)
14:29:11.287139 ARP, Request who-has ik1-312-16436.vs.sakura.ne.jp tell 153.126.152.1, length 46
14:29:11.387175 ARP, Request who-has ikr.tohritsu.co.jp tell 153.126.152.1, length 46
14:29:11.387278 ARP, Request who-has ik1-312-16173.vs.sakura.ne.jp tell 153.126.152.1, length 46
14:29:11.387942 IP ik1-312-16305.vs.sakura.ne.jp.47640 > dns13.sakura.ad.jp.domain: 59103+ PTR? 167.152.126.153.in-addr.arpa. (46)
14:29:11.389213 ARP, Request who-has ik1-312-16398.vs.sakura.ne.jp tell 153.126.152.2, length 46
14:29:11.399375 ARP, Request who-has ik1-312-16018.vs.sakura.ne.jp tell 153.126.152.2, length 46
14:29:11.399723 ARP, Request who-has ik1-312-16262.vs.sakura.ne.jp tell 153.126.152.2, length 46
14:29:11.408559 IP dns13.sakura.ad.jp.domain > ik1-312-16305.vs.sakura.ne.jp.47640: 59103 1/0/0 PTR ikr.tohritsu.co.jp. (78)
14:29:11.634366 IP 153.126.152.1 > vrrp.mcast.net: VRRPv2, Advertisement, vrid 13, prio 255, authtype simple, intvl 1s, length 20
14:29:11.634391 IP6 fe80::1 > ff02::12: ip-proto-112 40
14:29:11.665209 ARP, Request who-has ik1-312-16003.vs.sakura.ne.jp tell 153.126.152.1, length 46
14:29:11.665518 IP ik1-312-16305.vs.sakura.ne.jp.45897 > dns13.sakura.ad.jp.domain: 18838+ PTR? 7.152.126.153.in-addr.arpa. (44)
14:29:11.686084 IP dns13.sakura.ad.jp.domain > ik1-312-16305.vs.sakura.ne.jp.45897: 18838 1/0/0 PTR ik1-312-16003.vs.sakura.ne.jp. (87)
14:29:11.706201 ARP, Request who-has ik1-312-16255.vs.sakura.ne.jp tell 153.126.152.2, length 46
14:29:11.706270 ARP, Request who-has ik1-312-16375.vs.sakura.ne.jp tell 153.126.152.2, length 46
14:29:11.706554 IP ik1-312-16305.vs.sakura.ne.jp.56443 > dns13.sakura.ad.jp.domain: 12255+ PTR? 9.153.126.153.in-addr.arpa. (44)
14:29:11.724722 IP dns13.sakura.ad.jp.domain > ik1-312-16305.vs.sakura.ne.jp.56443: 12255 1/0/0 PTR ik1-312-16255.vs.sakura.ne.jp. (87)
14:29:11.725029 IP ik1-312-16305.vs.sakura.ne.jp.51677 > dns13.sakura.ad.jp.domain: 786+ PTR? 129.153.126.153.in-addr.arpa. (46)
14:29:11.745617 IP dns13.sakura.ad.jp.domain > ik1-312-16305.vs.sakura.ne.jp.51677: 786 1/0/0 PTR ik1-312-16375.vs.sakura.ne.jp. (89)
14:29:11.786462 ARP, Request who-has ik1-312-16127.vs.sakura.ne.jp tell 153.126.152.1, length 46
14:29:11.900188 ARP, Request who-has ik1-312-16377.vs.sakura.ne.jp tell 153.126.152.2, length 46
14:29:11.902575 IP ik1-312-16305.vs.sakura.ne.jp.35007 > dns13.sakura.ad.jp.domain: 40822+ PTR? 131.153.126.153.in-addr.arpa. (46)
14:29:11.920521 IP dns13.sakura.ad.jp.domain > ik1-312-16305.vs.sakura.ne.jp.35007: 40822 1/0/0 PTR ik1-312-16377.vs.sakura.ne.jp. (89)
14:29:11.944642 ARP, Request who-has ik1-312-16331.vs.sakura.ne.jp tell 153.126.152.2, length 46
14:29:11.944951 IP ik1-312-16305.vs.sakura.ne.jp.46035 > dns13.sakura.ad.jp.domain: 26867+ PTR? 85.153.126.153.in-addr.arpa. (45)
14:29:11.953368 ARP, Request who-has ik1-312-16347.vs.sakura.ne.jp tell 153.126.152.1, length 46
14:29:11.963200 IP dns13.sakura.ad.jp.domain > ik1-312-16305.vs.sakura.ne.jp.46035: 26867 1/0/0 PTR ik1-312-16331.vs.sakura.ne.jp. (88)
14:29:11.963599 IP ik1-312-16305.vs.sakura.ne.jp.60990 > dns13.sakura.ad.jp.domain: 56685+ PTR? 101.153.126.153.in-addr.arpa. (46)
14:29:11.981840 IP dns13.sakura.ad.jp.domain > ik1-312-16305.vs.sakura.ne.jp.60990: 56685 1/0/0 PTR ik1-312-16347.vs.sakura.ne.jp. (89)
14:29:12.001433 ARP, Request who-has ik1-312-16084.vs.sakura.ne.jp tell 153.126.152.2, length 46
14:29:12.001613 ARP, Request who-has ik1-312-16398.vs.sakura.ne.jp tell 153.126.152.2, length 46
14:29:12.001799 IP ik1-312-16305.vs.sakura.ne.jp.55185 > dns13.sakura.ad.jp.domain: 13009+ PTR? 88.152.126.153.in-addr.arpa. (45)
14:29:12.022165 IP dns13.sakura.ad.jp.domain > ik1-312-16305.vs.sakura.ne.jp.55185: 13009 1/0/0 PTR ik1-312-16084.vs.sakura.ne.jp. (88)
14:29:12.086412 ARP, Request who-has ik1-312-16130.vs.sakura.ne.jp tell 153.126.152.1, length 46
14:29:12.086751 ARP, Request who-has ik1-312-16394.vs.sakura.ne.jp tell 153.126.152.1, length 46
14:29:12.190452 ARP, Request who-has ik1-312-16042.vs.sakura.ne.jp tell 153.126.152.1, length 46
14:29:12.190564 ARP, Request who-has ik1-312-16396.vs.sakura.ne.jp tell 153.126.152.1, length 46
14:29:12.190776 IP ik1-312-16305.vs.sakura.ne.jp.43951 > dns13.sakura.ad.jp.domain: 16354+ PTR? 46.152.126.153.in-addr.arpa. (45)
14:29:12.209096 IP dns13.sakura.ad.jp.domain > ik1-312-16305.vs.sakura.ne.jp.43951: 16354 1/0/0 PTR ik1-312-16042.vs.sakura.ne.jp. (88)
14:29:12.209447 IP ik1-312-16305.vs.sakura.ne.jp.49185 > dns13.sakura.ad.jp.domain: 30870+ PTR? 150.153.126.153.in-addr.arpa. (46)
14:29:12.229711 IP dns13.sakura.ad.jp.domain > ik1-312-16305.vs.sakura.ne.jp.49185: 30870 1/0/0 PTR ik1-312-16396.vs.sakura.ne.jp. (89)
14:29:12.300019 ARP, Request who-has ik1-312-16331.vs.sakura.ne.jp tell 153.126.152.2, length 46
14:29:12.325855 ARP, Request who-has ik1-312-16373.vs.sakura.ne.jp tell 153.126.152.1, length 46
14:29:12.386546 ARP, Request who-has ik1-312-16003.vs.sakura.ne.jp tell 153.126.152.1, length 46
14:29:12.386699 ARP, Request who-has ik1-312-16173.vs.sakura.ne.jp tell 153.126.152.1, length 46
14:29:12.387091 ARP, Request who-has ik1-312-16347.vs.sakura.ne.jp tell 153.126.152.1, length 46
14:29:12.399444 ARP, Request who-has ik1-312-16018.vs.sakura.ne.jp tell 153.126.152.2, length 46
14:29:12.399792 ARP, Request who-has ik1-312-16262.vs.sakura.ne.jp tell 153.126.152.2, length 46
14:29:12.451237 ARP, Request who-has ik1-312-16378.vs.sakura.ne.jp tell 153.126.152.1, length 46
14:29:12.451562 IP ik1-312-16305.vs.sakura.ne.jp.38400 > dns13.sakura.ad.jp.domain: 39086+ PTR? 132.153.126.153.in-addr.arpa. (46)
14:29:12.472705 IP dns13.sakura.ad.jp.domain > ik1-312-16305.vs.sakura.ne.jp.38400: 39086 1/0/0 PTR ik1-312-16378.vs.sakura.ne.jp. (89)
14:29:12.486642 ARP, Request who-has ik1-312-16378.vs.sakura.ne.jp tell 153.126.152.1, length 46
14:29:12.505279 ARP, Request who-has ik1-312-16166.vs.sakura.ne.jp tell 153.126.152.1, length 46
14:29:12.505626 IP ik1-312-16305.vs.sakura.ne.jp.60942 > dns13.sakura.ad.jp.domain: 41183+ PTR? 170.152.126.153.in-addr.arpa. (46)
14:29:12.526206 IP dns13.sakura.ad.jp.domain > ik1-312-16305.vs.sakura.ne.jp.60942: 41183 1/0/0 PTR ik1-312-16166.vs.sakura.ne.jp. (89)
14:29:12.563043 IP i114-182-149-109.s05.a020.ap.plala.or.jp.54187 > ik1-312-16305.vs.sakura.ne.jp.ssh: Flags [P.], seq 97:193, ack 336, win 62, length 96

